Name,ScheduleState,KanbanState,PortfolioItem,Project,Iteration,Owner,PlanEstimate,Release,Description,Ready,Blocked,BlockedReason,DisplayColor,Notes,dataset
Validate Customer Contact/Shipping info,Accepted,Accepted,User Profile,Shopping Team,Iteration 6,daniel@acme.com,5,R2,"As a customer, I want my email and shipping addresses validated to make me known to the system, and to add another layer of protection against fraud.<br /><br /><u>Acceptance Criteria</u>:  <ul> <li> Email address validated  <ul> <li>validate format</li> <li>email them a message then have them confirm by clicking a link</li> </ul> </li> <li> Check Shipping  <ul> <li>Address must exist validate against USPS DFS2 Validation DB</li> </ul> </li> <li>Perform Validation upon creation/change of info and each order placed</li> </ul> <u>Definition of Done</u>:  <ul> <li>Code Checked In</li> <li>Unit Tested</li> <li>Accept Test Passed</li> <li>No Defects</li> <li>Accept Tests added to automated framework</li> <li>Oneline help docs updated</li> </ul>",FALSE,FALSE,,,,Summer
View By Order,Defined,Ready for Acceptance,User Profile,Shopping Team,Iteration 7,dave@acme.com,3,R2,"As a customer, I want to be able to view and easily change my One-Click settings.",FALSE,FALSE,,,,Summer
View or Change your One-Click settings,Defined,Ready for Acceptance,User Profile,Shopping Team,Iteration 7,dave@acme.com,,R2,"As a customer, I want to be able to view and easily change my One-Click settings.",FALSE,FALSE,,,,Summer
Search for packing slips,Accepted,Accepted,Archive packing slips,Fulfillment Team,Iteration 1,,3,R1,,FALSE,FALSE,,,,Summer
Auto delete packing slips after 6 months,Accepted,Accepted,Archive packing slips,Fulfillment Team,Iteration 2,,3,R1,,FALSE,FALSE,,,,Summer
Reactivate packing slips,Accepted,Accepted,Archive packing slips,Fulfillment Team,Iteration 1,,1,R1,,FALSE,FALSE,,,,Summer
Return labels printing first/last name in wrong order.,Accepted,Accepted,Returned shipments,Fulfillment Team,Iteration 2,,1,R1,,FALSE,FALSE,,,,Summer
Implement barcode tracking for return items,Accepted,Accepted,Returned shipments,Fulfillment Team,Iteration 2,,5,R1,,FALSE,FALSE,,,,Summer
Apply credits to account from valid return items,Accepted,Accepted,Returned shipments,Fulfillment Team,Iteration 1,,3,R1,,FALSE,FALSE,,,,Summer
Update warehouse stock counts,Accepted,Accepted,Returned shipments,Fulfillment Team,Iteration 1,,3,R1,,FALSE,FALSE,,,,Summer
Email notifications upon successful return processing,Accepted,Accepted,Returned shipments,Fulfillment Team,Iteration 1,,3,R1,,FALSE,FALSE,,,,Summer
Implement self printed return receipts,Defined,,Returned shipments,Fulfillment Team,,,5,R1,,FALSE,,,,,Summer
Show return status on order history page,Defined,,Returned shipments,Fulfillment Team,,,3,R1,,FALSE,,,,,Summer
Mobile notification of return status,Defined,,Returned shipments,Fulfillment Team,,,8,R1,,FALSE,,,,,Summer
Prescription Administration Updates,In-Progress,In Dev,,Medical Records App,Iteration 4 - New Patients,,4,2.5,"As a web site visitor, I want to browse through the inventory of available safaris so that I can pick one that fits my time, budget and interest.",,FALSE,,,,Summer
Physician Chat Environment,Completed,Ready for Acceptance,,Medical Records App,Iteration 4 - New Patients,,,2.5,"As a web site visitor, I want to view upcoming safari availability so that I can choose an available date.",,FALSE,,,,Summer
Register for New Patient Service,In-Progress,In Dev,,Medical Records App,Iteration 4 - New Patients,,4,2.5,"As a safari-taker, I want to sign-up for a Frequent Adventurer Card so I can earn rewards.",,TRUE,Test Server Failure,,,Summer
Update Patient Records,Accepted,Accepted,,Medical Records App,Iteration 4 - New Patients,,8,2.5,"As a safari-taker, I want to view any pictures taken and be able to order reprints so that I can remember my trip.",,FALSE,,,,Summer
Admin - Accept new patients,In-Progress,In Dev,,Medical Records App,Iteration 4 - New Patients,,4,2.5,Admin - Accept new patients,,FALSE,,,,Summer
Validate Patient Data for EU Patients,Defined,Prioritized,,Medical Records App,Iteration 5 - User Administration,,3,2.5,,,,,,,Summer
Support for UK National Insurance Number Format,Defined,Prioritized,,Medical Records App,Iteration 5 - User Administration,,,2.5,,,,,,,Summer
Physician Application - confirm prescription data,Defined,Prioritized,,Medical Records App,,,,,,,,,,,Summer
